{"error":"trace entry of tick 01M67BHPK3PQSMPPWKK11JMVMK is corrupt: tick 01M67BHPK3PQSMPPWKK11JMVMK names chunk 2900a17a23d76536a01e7199d426b786acdd5b0c563c6aa1cb026109910e57e5, which is not in 2026-10-30.chunks.jsonl","do_instead":"norn run list gh-1","code":"trace_corrupt","details":[{"file":"2026-10-30.chunks.jsonl","errors":[{"path":"","message":"tick 01M67BHPK3PQSMPPWKK11JMVMK names chunk 2900a17a23d76536a01e7199d426b786acdd5b0c563c6aa1cb026109910e57e5, which is not in 2026-10-30.chunks.jsonl"}]}]}
